,0
71,많은 생각을 하게 하는 영화 음악도 좋고 한 번 더 보고싶은 영화  보고나니 마음이 훈훈해지는 영화  난 2시간 전으로 시간을 돌려도 이 영화를 볼 것이다  교훈이 있는 영화네요  진짜최고 너무 이쁜 영화입니다 보는 내내 행복행복  최고최고최고또보고싶은영화  개봉후 영화관에서 한번 다시 오늘새벽에 다시영화를 보게되었는데 언제봐도 정말 감동적인 영화인것같다 처음 영화를 보고난후에는 별생각없이 그냥 볼만한 영화구나 라고 생각이들었지만 두번째 오늘영화를 보고난후엔 첫영화와달 홍보는 무슨 로맨틱 코메디 영화인 마냥가볍게 봤다가 뒷통수를 맞고가는 느낌물론 아주 좋은 의미로  영화관에 가서 두번 본 영화는 처음이다  과거의 무언가를 바꾸고 싶다는 미련과 미래에 대한생각은  잊고 현재를 재밌고 충실하게 살아야겠다는 생각을 남긴 영화  재밌게보고있다가 후반부는너무나도뭉클했다인생이란  원래 이런장르는 안보고 살앗다 어바웃타임 정말 재미있게 봣다 진짜 내생애 로맨스영화 넘버원이다  아름답고 유쾌한 영화다  가슴짠하게해주는 그런 영화  결국 영화가 주는 메시지는 주어진 하루에 최선을 다하자라는 조금은 뻔한 결말이었지만 가족을 배경으로 따뜻함을 주는 영화였다  감동적이고 맥아담도 이쁘고  시간은 되돌릴 수도 없지만 그럴 필요도 없다 정말 엄청난 교훈과 감동을 받았습니다  배우들의 연기도 너무좋았고 무엇보다 내용이 너무 좋았습니다 가슴이 따뜻해지고 훈훈해지는 감동명작이었습니다  10점 만점에 10점인생에 대해서 하루의 소중함에 대해 일깨워준 좋은 영화였습니다♡  레이첼 맥아담스 이처럼 사랑스러운 배우가 있었구나많은 한국 남성들의 이상형으로 떠오른 그녀그녀를 제외 하고도 이 영화는 내가 살아가는 삶의 방향을 한단계 성장할 수 있도록 도와준 것 같다  현재 이시간을 소 영화 끝나고 단순히 슬퍼서가 아니라 여러 감정이 복받쳐서 엉엉 울어본 것도 정말 오랜만이다 당장 가족들에게 달려가 찐하게 껴앉고 싶어지게 만드는 영화 별 10개로도 모자라ㅠㅠ  이런이런 여운이 남는규만  나 생첨으루 영화보고 댓글단다 다시한번 생각하게 해주는 따뜻한 영화다 그리고 영국의대한 시민의식두 참멋지다 신사의 나라답다  
72,다시보고싶은영화 가족의사랑이느껴지는  최고의 영화 내 인생을 다시한번 되 돌아보고 또한 앞으로 남은 인생을 소중히 여기게 해주는 그런 영화  
73,보는내내 가슴이 따뜻해지고 느끼는것이 많은 작품이였다  레이첼 맥아담스의 영화는 후회가 없는것 같아요비중은 적었지만 핫칙 이후로 그녀에게 반한 후그녀가 나오는 영화라면 보게되네요ㅋ  
74,최고인듯 따뜻함 너무좋아  너무나도 러블리한 영화다 최고 이런 영화가 좀 많이 나왔음 좋겠네  너무 큰 감동을 준 영화  아니 뭐 이렇게 사랑스러워  
75,잔잔 유쾌 의미  최고의 영화네요  시간을 거스르는 초능력과 정해진 운명그리고 오늘에 남겨진 여운들과 다가올 내일  우리는 지금도 하루 24시간1440분86400초 1초에 1초가 흘러가는 법칙속에서 시간여행을 하고 있다 과거가 아닌 지금 이순간  흘러가는 1분 1초에 에 충실할때 비로써 진정한 나를 찾을 수 있지 않을까 생각 이곳저곳 시간을 여행하며 얻은 교훈은 현재를 100퍼센트 살아갈 것이었다 시간여행이란 진부한 장치로 빚어낸 유려한 이야기의 곡선 잘 빚은 도자기안에 담아넣은 담백한 주제   사랑하고싶어지는 달달한 영화  진짜재밌어요 다시보고싶내요  
76,재밌어요 감동적이기도 하그요  아빠가 죽기 전으로 타임워프 해서 사는 걸 되풀이하면 시간 흐름속에서 영원히 루프하며 죽지않고 사는 딜레마  완전재밌게봤는데 1점주는사람뭐   인생을 아름답게 사는것은 현실에 감사하는 것인듯  시간보다 더 소중한 것을 받은 기분입니다  정말 가슴이 따뜻해지는 영화  너무 평범하고 화목하고 아름다워서 가족 판타지 같은 영화  조금도 억울함도 없는 삶을 지금 이 인생을 다시 한번 똑 같이살아도 좋다는 마음으로 살라ㅡ 니체 ㅡ  13년도에 본 영화중 최고 역시 워타임  재미도있고 감동적이고 정말 감명깊게 봤어요  정말 감동적이다    
77,보고나서 매우 좋습니다  뭔가 마음을 울리는 영화네요 재밌어요 꼭 보세요  감동을 주는영화 적극추천  마음이 따뜻해 지는영화 그 여운이 진해서 좋은영화 보신분들도 다시 한번 보시면 좋을 것 같아요        내가 이 영화를 평가할만한 수준이 되는 지는 모르겠지만얼마살지 않은 삶에서 손에 꼽히는 영화로 자리잡은 것  재밋는거같아요  아 토요일 눈뜨자마자봤는데 마음이말랑말랑해져따  인생최고의영화 탑10으로 선정했습니다  하루하루를 최선을다해 살아가야하는 이유  첨에는 로맨스였지만 중반부 이후로는 소소한 인생의 아름다움과 소중함을 느낄수 있게해주는 영화다 마음이 따듯해지는걸 느낀다  이 좋은 영화를 이제야 봤다니 명작명작  내 삶도 영화가 될 수 있구나 하는 생각  적어도 나는 이영화를보며 따뜻함을느꼈다  우리모두 하루하루 열심히살아갑시다  그냥 사랑이야기가 아니라서 더 좋았습니다  일상적이고 잔잔하지만 절대 평범하지 않다  평범한 일상의 긴장과 걱정때문에 알수없었던 세상의 아름다움을 느껴라  정말 저도 오늘 하루를 다시살면 즐겁게 보낼 수 있었을 지도 모릅니다  기자 평론가들은 우리랑 다른 세상 사람들인가  마지막 유년시절로 돌아가 아버지와 마지막 산책하는 장면은 수만가지 생각과 감정들이 떠오르게 만드는 명장면 이었다  잔잔하면서 흐뭇한 미소를 띄게 된다  아 정말 좋네요  도입부는  싱그럽게 웃으면서 볼 수 있었던 영화후반부는 사는 순간순간을 소중하게 느껴라 시간을 되돌릴 순 있지만 결과를 되돌릴 순 없다는 교훈을 주는 가슴 먹먹해지는 영화  영화관에서 못본게 아쉽다  오랜만에 여운남는 영화다진심 추천하고싶음ㅠㅠ  10점이상을 줘도 아쉬울영화  기자와 평론가의 평점은 안 보는 게 낫다는 걸 알았다  단순한 사랑영화는 아닌가 싶다  이렇게 좋은영화 오랜만에 본듯  교훈도있고 재미도있고 감동도있고  가슴벅차네요 설렐줄알았더니 슬프기까지  
78,나도시간여행좀하고싶다  굉장히 좋은영화  잘만들었어요 돈아깝진 않았음  개성이 강하고 따듯한 영화였다  왜 10자 이상으로 글을 남겨야 되지 그냥 재밌다 만 남길라 했는데                       이란 대사가 마음에  소중하다 생각하면 다가가라  참 예쁜영화 달달한영화  많이 느끼고 배운 정말 좋은 영화  최곱니다 길게 말할필요가 없네요 굿  감동따뜻베스트오브베스트  시나리오 도 느낌도 최고의 영화  맥아담스 너무 사랑스럽네요잔잔히 좋습니다  무조건 봅니다 그냥 닥치고 보세요  많을 걸 생각하게 만드는 영화매순간 최선을 다하고 주변사람들을 생각하게 만드는영화마지막에 아버지와 산책씬은 오랫동안 기억에 남을거같다  명작이에요 감동적이고 이유가필요없네요  봐 힘든 사람 외로운 사람 지친 사람 행복하고 싶은 사람 다 봐 보면 알아 이건 대작이다  
79,ㅎㅎ 저도 저런경험해보고싶을만큼재밋습니다  기대 안하고 보러갔는데 너무재밌엇고 올해 최고의 로맨틱코미디  감동이네요 소장하고 보고 또 보고 싶어요  너무재밌게봤어요 기자평은 믿을게 못됨  아 정말 긴긴 여운을 남겼다긴장감 감동 사랑스러움이렇게 뜨겁게 사랑하는 남자 멋잇다시작하는 연인이라면 꼭 봐야할영화  정말 너무 따뜻하고 좋은영화였다 감동이라기보다 뭔가모르는 벅차오름과 따뜻함을 느꼈다 그저그런 사랑얘기로 알고 본다면 뒷통수맞을거다 너무 좋은영화라는것과 뭔지모를 공감이가는 참 따뜻한영화만점별점이 아깝 비바람을 맞아옷이 다 젖었는데도 마냥 즐거워하는 하객들 이사람들은 주인공이 수십번의 시간여행을 통해깨달은 인생 순간순간을 즐기고 음미하며 살자  라는걸 이미 알고 실천하고있었다  그럼 이사람들도 정말 따뜻한 영화 오랜만이었어요  최근에 본 영화중 가장 아름다운 영화였습니다  오랜만에 영화보면서 울었네요  지금도 울컥함 그냥 킬링타임용으로 생각하고 봤는데 너무나 많은 생각을 하게 되는 영화인듯 진짜 좋아요 제가 원래 영화 한번보면 또 안보는데 이건 또보고싶어져요 지금은 혼자봤지만  굉장히 유치한 소재임에도 전혀 유치하지가 않다  많은생각을 하게 만드는 내용이에요  웰메이드영화표본이요  하루하루 반복되는 일상에 지쳐갈때즘 만난영화 영화 점퍼이후 갖고 싶은 초능력중 하나가 더생겼지만 그보다 큰건 가슴한켠에 남은 그 무언가다  말이필요없음 정말 최고의 영화  이렇게 큰 교훈과 감동을 준 로맨스영화는 이게 처음이자 마지막일것같다이런영화가 많이나왔으면 로맨스물이지만 그보다 더 큰 의미와 교훈을 준다  진짜 왠만한 영화엔 평점 잘 안다는데 그것도 나 액션물만 찾던 나에게 로맨틱 장르에 평점주는건 처음이다 연인 가족 모두 교훈을 줄수있는 영화 그렇다고 주인공처럼 어두운 방에가서 동작 따라하지 말고 평소에 우린 감독님 러브액츄얼리때 연출력 반만 나왔어도만점짜리각본이였습니다 도대체 무슨일이 있던겁니까내 생애 최고의영화를 연출하신분이 왜 이렇게찍으셨나요 안타깝습니다  눈물이 왈칵 쏟아지지는 않았지만 꽤 감동적이고 여운이 남았던 영화 삶에 메세지를 주는 영화  너무재밋고 감동이에요  이영화에서 가장멋진남자는 아버지다  많은 생각을 하게 해주는 영화  색감은 이뻐서 2점 줍니다 쩝 한달 동안 기대하다가 기회가 생겨서 본 영화인데 같이 간 3사람한테 미안해 죽는줄 알았음  내가 고르는 영화가 저번에도 실패해서 이번엔 주위평도 좋길래 평점도 좋고 그래서 봤 지루한 감이 없지않아 있음  뭐랄까 타임슬립내용은 엉성하고 말이 안되는데 드라마적 요소는 충분히 재밌었다 로맨틱코미디물로는 웰메이드작이었다고 본다 레이첼 맥아담스가 단연 돋보인다 후반부가 아쉬운데 뭔가 사건을 만들라고 동생과 아버지에 대한 마지막으로 아버지를 보러간 마지막 시간여행부터 폭풍 눈물을 흘릴 수 밖에 없었다 단순한 러브 코메디물이 아닌 인생에까지 교훈을 주는 다시는 없을 멋진 영화 내가 본 영화중에 최고라고 말할 수 있다표지에  인생은 한 번 살아서 그 의미가 있었다는 것시간은 누구에게나 공평하지만 행복을 똑같이 주진 않으니 좋은 선택을 하는것이 중요하다는걸 깨닫게 해줬다  내가 30년 넘게 살면서 한달에 평균적으로 3편이상은 보는 편인데 감히 올해가 아니라 내 인생 최고의 영화 한손안에 든다고 말할수 있다 정말 간만에 며칠간 여운을 준 영화였다  정말 오랜만에 나에게 큰 휴유증을 안겨준 영화다 최근에 본 많은 한국식 로멘틱 코메디로 인헤 봐도 남는 것 없는 영화에 지쳐가고 있었는데 이 영화는 나에게 큰 충격을 주었다 잔잔한감동과 소소한 웃음 그리고 엄청난 정말 보고나서 이렇게 많은 감정이 나는 영화는 오랜만인것같다 정말 와너무 사랑스럽다  주인공과 그의 아버지의 해변가장면이 너무 애뜻하고 가슴이 먹먹하게 진한 감동이 느껴지네요  가슴 따뜻해지는 영화ㅇ  멜로영화 싫어해서 기대안하고 봤는데 보다보니까 계속보게되네요  와 간만에 10점 주는 영화다  너무 좋았다  최고다ㅠㅠ 만약 시간을 되돌릴 수 있는 능력이 있다면 이 영화를 볼까 말까 망설이기 전으로 되돌아갈것이다 망설인 시간이 너무 아깝다  단순한 로맨스 킬링타임용이라고 생각한 내가 어리석었다너무 재밌고 감동적이었음 꼭 한번은 봐야할 영화   부모와의 사랑 연인과의 사랑 형자매와의 사랑 모든 사랑  언젠가부터 나는 고2로 돌아가는 꿈을 꾸고 과거에 집착하고 있다 몇년째 이영화를 보니까 더욱 공허해진다 큰일이다ㅋ 모르겠다 나도  이영화를 보구나선 나의  하루를 조금은 소중하게 생각하게 하게끔 하는 영화  뭐가 그렇게 재밌다고 지루한데 별론데  삶을 자기 멋대로 조작해놓고 마지막엔 행복을 논하네이봐요 삶은 희노애락 속에 의미를 찾는거지 당신처럼희희희희로 조작해놓고 행복을 논하니 참 웃기구려  슬퍼서 우는 게 아니라 짠해서 눈물 흘리게 하는 마법의 시간여행  재미와 감동이 있는 영화네요영화관에서 이거 볼까 하다가 평론가 평점 보고안봤던 영화인데요영화 끝나고도 잔잔한 감동도 있고 도 좋아서 듣고 있습니다 평론가들 수준 너무 높으신분들이라서 그런가보네요  감동교훈웃음 모든 것을 지닌 감동적인 영화였다  안봤다면 봐야할영화 1위  대단한 소름을 주는 대작까진 아니었지만 깊고 진한 감동과 여운을 주는 명작이었다 훈훈함의 정의를 영화내내 보여준달까 매순간의 행복을 충분히 만끽하라는 교훈 그리고 음악도 정말 좋았다  정말 최고ㅠㅠ 그냥 멜로인줄로만 알았는데 너무나 많은 것을 주는 영화 정말 긴 여운이 남을것같다  영화보면서 처음으로 끝나고서 못일어나고 앉아서 생각에잠기게 되내  항상 이 시간에 최선을 다 하고 즐겁게 행복하게 살자  이런 영화보는재미에 사는거지  장르에 멜로 로맨스라고 나와있길래 진부한 남녀간의 사랑 이야기 일줄 알았는데 오히려 멜로보다는 성장 철학 쪽에 가깝다고 해야하나 삶 산다는 것에 대해 많은 생각이 들었습니다 소장하고 싶은 영화에요  재미지다 로맨스 짱♥  단순한 교훈영화라 치부하기엔 너무나 세련되고 담백하게 연출되었다커다란 주제를 억지로 밀지도 않으며 삶의 구석구석이 너무나 부드럽게 녹아있다 유치한 영화가 될 수도 있었을텐데 작가와 감독의 세련된 감각에 박수를 보 
