,0
0,시간을 되돌릴 수 있다면… 결과는 같다 씨네21  이현경  스포성 전문가 평점 좀 없었으면 좋겠다 젠장  가슴을 따뜻하게 해주는 정말 완전소중한 영화 ㅠㅠ  아버지와 탁구시합 후 산책하러 가는장면에서 너무 많이울었네요 지금도 눈물이 살짝 고이네요네이버 평점에 처음 글 남깁니다 너무 감동이었고 다시금보고프게 만드는 영화입니다  재밋습니다 후회없습니다  가슴 따뜻해지는 영화입니다 올겨울 강추  하루 하루를 어떻케 살아야 되는지 느끼게 해주는 영화   올해본 영화중 최고다 처음에는 가볍고 웃기게 전개되지만 끝에는 교훈과 따뜻함을 주는영화다  
1,마지막으로 아버지와 함께 보낼때 눈물 펑펑 쏟았다ㅠㅠ  인생이 바로 시간여행을하는것이다 라는 독백과 과연 나는 시간을되돌릴수있다면 언제로돌릴수있을까 난 과연 현재에 충실히 살고있는것인가란 화두를 던져주는영화  레이첼 맥아덤스 넘 이쁘네요  기자 평론가들은 영화를 보면서 무슨 생각을 하고 보는진 모르겟지만 일반적으로 이 영화 보고 저런 생각 안들껍니다 재밌고 작은 감동 교훈  기대 하지 않았던 길모퉁이의 맛집의 따뜻함  영화를 보면 누구나 공감한다 이건명작이라고  진짜 감동이었음 이번해 개봉영화중에 제일 따뜻하고 달달한듯  10점이 절대 아깝지 않은 영화 달달한 로맨스도 좋지만 가슴 먹먹한 부자의 애정도 매우 인상깊었습니다 간만에 눈물 빼고 영화봤네요  그저 사랑타령하는 로맨스코미디가 아니라 마지막엔 가족이 보였다 그리고 두번사는것처럼 순간에 최선을 다하게 됬다또 집에와서 부모님을 안아드렸다  
2,주어진 시간 일상의 소중함을 다시 생각합니다그럼에도 되돌리고 싶은 과거 몇장면은 자꾸 떠오르네요  기자평론가란 영화평을 하는 사람이다 네이버 기자 평론가중에는 박쥐들이나 거만쟁이 아니면 스포 남발하는 얼간이들도 있더라  시간 되돌려 가면서까지 연애하는법좀 배워볼려다가 인생을 배우고 온 영화  씨네21 이현경 뭐하는 짓이냐 평론가라는게 스포질이냐 개념좀 챙겨라 기본도 안되면서 뭘 평론한다는거냐  두근거리러왔다가 감동과 교훈까지 얻고간다  어쩜 유치하기 짝이 없는 진부한 상상을 토대로 이런 아름다운 영화를 만들 수 있는건지ㅠㅠ  
3,몇 일간이였지만 삶에 태도를 바꿔줬으니  최고  평론가의 평점에도 공감 비공감 누를 수 있게하라  평론가들의 리뷰를 보고 결말을 알아버린 것 같아 김 샜지만 왠걸 매 순간 순간을 행복하게 살자는 게 어떻게 결과가 같다는 식으로 표현되는지 이해가 가지 않는다 아름다운 음악과 사랑스러운 두 남녀 가족들의 웃음에 이 영화를 보는 도중 잠들어 버린 여친 그녀는 분명 아무 감정을 못느끼는 사이코 패스임을 확신 하고 나는 영화가 끝나고 그녀에게 바로 이별을 고했다  남은 보름동안 이 이상의 영화가 나오지 않는다면 2013년 최고의 영화 타이틀을 주고 싶다  
4,다시봐도재밌는영화뭔가뭉킁  이영화는 2번 3번봐도 아깝지않을 명작입니다  
5,결과적으로 시간을 되돌아가서 상황을 바꾸는 것이 아니라 그 상황을 대하는 마음가짐을 바꾸게 되면서 인생을 순리대로 살아가는 그래서 아버지도 결국 보내게 되는거고 아 뭐라 하나만 콕 짚어서 말하기엔 어려울 강추합니다 기분좋아지는 영화  아침 조조영화로 보앗는데아침에 봐서그런가 좀더 감동이 또 여운이 길게 간것같다 주인공이 시간을돌려 자기 사랑을 이뤄나가는것 멜로로맨스 영화야 뻔한 전개일수 있지만 우리는 그걸 알면서도 따뜻한 겨울 로맨스가  
6,이 퀄리티는 유지하는구나 믿고 보는 워킹타이틀  
7,시간을 되돌릴수는 없지만 그 안에서 많은 것들을 느낄수 있게 해주는 수작입니다  간만에 제대로 돌아온 로코장인의 제대된 데이트 무비  진심 내가 영화 300편 정도 보고 최고의 영화는 인셉션 이라생각했었는데 어바웃 타임이 모든걸  깨버렸음 진심 평점 매기는것도 처음이고 두번정도 더 볼 생각이다 진심 와 대단한 영화  벅차오르는 이감동은 대체 머지  
8,일상의 행복을 일깨워준 영화  예고만 본다면 하나의 사랑이야기 같지만 더 큰 가족의 사랑을 담고 있습니다 마지막 장면에서 정말 많이  우시게 될겁니다  남주랑 여주랑 처음 만나는장면이 왜이리 설레고 두근되던지요 레이첼 맥아덤즈 넘넘 사랑스럽고 내용도 재밌고 교훈도있고 베스트3에 꼽는 영화인 것 같아요  씨네21 영화평은 기자들이 한 건가그래도 문과 나왔을 텐데 수준이 다들 왜 그모양인지가슴이 따뜻해지고 쉽게 지나쳤던 일상에 애정을 느끼게 만드는 교훈까지 겸비한 종합선물세트 영화입니다 강추  추천드리고 싶습니다 로맨틱 영화가 주인줄 알고 들어갔다가 다른 것들로 펑펑 울고왔네요 다시는 되돌릴수 없는 어쩌면 마지막인 순간들 그리고 사랑에 빠진 두사람이 부모가 되어 간다는것진심을 다해 추천드립니다  최고 ㅠㅠ 최고최고 일상을돌아보게반드는영화 ㅎ  흔하다고 생각할 수있는 타임슬립이란 주제로 최고의 감동을 주었습니다 보고나면 누구든지 가슴이 따뜻해지고 뜨거운 먹먹함을 느끼실 겁니다  딴말은 하나도 필요없고 진짜 최고였다 넘 재밋게 봤음 등장인물 하나하나 다 좋았다 정말 마음 따듯해지고 행복한 영화 특히나 아부지와의 씬들은 정말 너무 좋았다 교훈도있고 감동도있고 재미도있고 너무 좋았음 로코라해서 킬링타임용인 줄 알았는데 거의나중에는 진짜 많은 생각을 하게 만드는 영화였음 영상미도 좋았고 인물들도 굿  영화끝나고 박수를 치고싶었다  돈주고 볼 가치가 있는 아름다운 영화  
9,기대했던 것만큼은 아니었다 모두가 처음부터 행복하게 시작했다 그러나 보는 내내 기분 좋았다 음악도 머릿속에 맴돈다  극장에 나오면서 가슴이 따뜻해지는 영화입니다 ㅎ  평점 10점도 부족함  눈물 흘리면서 봤습니다 정말 훈훈하고 기대 이상으로 재미있었음  
10,아름답다   액션스릴러공포가 아닌 장르의영화를 찾다가 포스터와 제목만보고 예매했는데 뭉클합니다 오랜만에 싱글싱글웃으면서 영화봤네요  지인에게 이영화 어때 재밌어라는 질문을 받았을때 아름다운 시간을 살수 있는 영화라고 당당하게 답해줄수 있는 영화  진짜 가슴 따뜻한영화 굿굿  제일 좋았던 부분은 주인공이 서로다른태도를 가지고 하루를 두번사는 부분이다 매일매일 감사하고 행복하게 살아야겠다는 결심을 하게된다 오늘이라는 하루는 선물이기에 강추♡  매 순간을 소중히 여겨야 한다는것을 확실하게 보여준다 순간순간을 너무 소중하게 만들어준다  최고 감히 내인생에서 최고의 영화라 하고 싶네요 주어진 삶에 대한 감사와 잊고 있었던 사소함에 소중함을 느낄수 있게 해주는 영화영화가 끝나고 엔딩크레딧이 올라가는데 눈물이 나네요 아마 엔딩크레딧이 한시간이었 오랜만에 악역없는 선한영화 자극적이지않은 단백한영화 연말에 따뜻함을 느껴보기에 좋은영화  내 메마른감성에 물대포를 쏴버렸다  영화에 처음으로 평점남겨본다개봉날 봤는데 다 보고도 계속 여운이 남는 이후로도 여러번 볼것같은 영화  사랑하는 사람이랑 꼭봐라  감독님한테 고맙다는 생각이 든게 오랜만이네 이 영화는 일년에 한번씩 꼭 봐줘야겠다  가슴으로 울었다 벅차오르고 또 보고 싶어지네요  하루를 두 번씩 살아보라는 아버지의 말에 가슴이 뭉클했다  억지스러운 감동을 궂이 끄집어내지않아도 흘러가듯 가슴이 벅차오르고 눈물나오는 영화  따뜻하다 사랑하는 가족들을 하나둘 떠올리게 만드는 영화 내일은 친정아빠한테 전화를 해야겠다  생각을 하게끔 만드는 영화에요 아주머니들은 눈물을 훔치시던데 삶을 좀 더 애틋하고 소중하게 살아가야겠다는 생각이 들어요 시간있으시면 한 번 보시길  좋은영화네요 따뜻한영화네요  내 인생 최고의 영화 처음부터 끝까지 보는 내내 행복했던 영화  내 인생에 손꼽히는 영화로 남을듯이건 봐야 아는 영화다올해가 가기 전에 아니 하루라도 빨리 보라고 권하고 싶은 영화다 더 이상의 감상평은 아껴두련다  돼지고기먹을 돈 내고 한우 투플 실컷 먹은 느낌 로코를 넘어서 시간과 인생 가족에 대해 말하는 영화  
11,마음이 촉촉해지는 영화  헐리우드 혹은 유럽영화는 상술이 가득한 상업영화라고 치부하는 모자란 평론가들은 보라아어바웃타임 이것이 바로 진짜 시나리오란 것이고 프로페셔널한 연출이란 것이며 이런 것이 모여 바로 진정한 영화가 되는 것이다 알 기자 새끼들 점수 낮게주네 진짜 재밌는 영화를 강추 꼭보세요  근 몇년간 영화관에서 본 영화중 최고영화관에서 기립박수칠뻔했다  
12,운명을 잡는 것은 시간을 돌리는 것이 아니라 현재에 집중하는 것이다  소장하고싶어요 이 영화 계속 보고싶네요  지금까지 내 생에서가장 의미있는 영화이고 그리 될것이다단 한 번도 가족끼리 영화본적 없었던우리 집이 영화를 함께 보기위해 노력하는내 모습이 영화를 함께 보고 행복해하는가족들의 모습이 보입니다내 인생 가장 보고 울었다 진짜 펑펑울었다  좋은 의미의 시간 여행 열한시와 비교됨  1년간 열심히 달려오느라 방전되기 직전에 있는 우리를 위로해주는  좋은 영화입니다하루를 두 번 살아 보거라는 아버지의 말에 따라상쾌한 모습으로 먹을 거리를 사는 팀의 모습과그런 모습에 웃으며 응대 
13,수많은영화를봤지만 내인생영화중에 하나에들어가는영화  오랜만에 보고서 후회가 안드는 영화를 보았다 여운도 남고 교훈도 주며 중간중간 웃게 만드는 장면까지 추천합니다 어바웃타임  잔잔한 감동 행복해지는영화 아빠생각 많이 났어요 ㅠ  오랜만에 영화다운 영화가 나온듯 여자 개예쁨  영화의 메세지가 너무나 강렬했고 가슴 아팠다   베스트평점님 님부터 글 내리시죠 ㅡㅡ  이런 영화 만들어줘서 고마워요 감독님  같은 하루를 두번째 살 때 여유있게 주변을 돌아보고 순간을 즐기게 된 주인공을 보며 오늘 하루동안의 내모습을 되새겨봤다 일상에 지친 분들에겐 더 없이 좋을 영화   마음이따뜻해지고 삶을 되돌아볼 수 있는 영화  솔까말 중간에 조금 지루햇는데 후반에 엄청난 감동의 쓰나미가 밀려왔다  영상도 예쁘고 음악도 좋고 배우들의 연기도 훌륭했고 내용도 의미있었습니다 결국 영화가 말하는 행복은 그리 먼 곳에 있는 것이 아닌 매일의 일상 속에 있다는 것입니다 다시 보고 싶어지네요  아들은 시행착오를 겪으며 아버지가 된다  초반에는 뭐지아버지의 감동여주인공의 사랑스러움에 완전 빠져버린잔잔한 감동까지  
14,비가와도 태풍이 와도 행복한 그들  몇번을 봐도 질리지 않을 선물같은 영화였습니다 도 너무 좋았다는   
15,현재 이순간이 내 삶의 마지막 순간인것처럼  
16,아버지와아들의 마지막 탁구가 감명깊엇습니당  
17,별다른 특수효과 없이 초능력을 사용하는 장면을 연출해낸다는게 신선했습니다 스토리도 감동적이고 재미있게 몰입해서 잘 봤습니다  
18,인생 영화 삶에 비칠 때 다시 보면 하루하루가 소중함을 다시금 깨닫는다  
19,2013년에 봤을때와 2019년에 다시 보게 되었을때 이렇게도 다른 느낌이 들 수 있다니ㅠㅠ 역시 내 인생영화  
20,결국 시간을 돌리는 것 보다 현재의 삶을 충실하게 사는것이 최종이라는 메시지 현대 사회를 살아가는 우리에게 후회를 하는 것에 대한 짐을 덜어주는 것은 아닐까  
21,시간이 주어졌을 때 열심히 살자  
22,한 여자와 자신의 연을 만들기위해 고군분투하는 모습이 자연스럽게 녹아든 영화였다늘 느끼는거지만 로맨틱한 영화를 보면 나도 영화내용처럼 사랑하고픈 생각이 마구마구마구마구든다  영화를 보는내내 미소가 입에서 떠나질 않네요  추운 겨울에 마음을 따뜻하게 해줄 영화라고 생각하빈다  연인과 봐도 좋고 가족과 봐도 좋은 예쁘고 훈훈한 영화 최고입니다   로코를 보러갔다 교훈을 얻는 영화 단순하게 보다가 심오하게 생각하게 되는 영화 정말 혼자서 감정이입을 하며 똑같이 웃고 안타까워하며 나도 그렇다면 하면서 돌아오는 길에 자꾸 상상하고있다    
23,여주인공이 예뻤다 예뻤다  
24,내 인생 최고의 영화 중 하나 입니다  
25,제인생에 가장기억남는 영화중 하나입니다  영국식 코미디의 재미와 잔잔하고 큰 감동을 느낄 수 있는 영화 가족의 소중함을 다시 한 번 일깨워주는 웰메이드 필름 영화 전체에 흐르는 주옥같은 음악들영국식 농담 너무 재밌어요 헌데 영국 변호사는 지하철 타 나이 30  지금까지본 영화중에 최고  
26,영화 자체는 다시 봐도 명작임에 틀림없다 단지 극중 아버지가 내 아버지와는 너무나도 다르게 현명하고 센스 넘치면서 자식애도 강하다는것 나도 저런 아버지가 내 진짜 아버지였다면 주인공 너무 부럽네  러브액츄얼리같은 서양 로멘틱 코메디의 스타일이네요 훈훈하고 교훈도 있고 시간여행이라는 소재도 잘살려서 재미있었어요 같은 로멘틱코메디인 결혼전야랑 완전 급이다른 영화임 추천  마음이 편해지고 잔잔한 영화입니다  난 정말 이영화를 보기를 잘한거같다  올해본영화중최고의영화  
27,또다시 개봉해도 다시 볼 영화  
28,스포일러가 포함된 감상평입니다 감상평 보기재미있고 감동도 있고 교훈도 있지만 우린 시간을 되돌릴 수 없다  
29,나도 시간여행 가능한 장롱 하나 있었으면 좋겠다ㅋ  기대 안하고봐서인지 너무 잘봤어요 지금 제 인생에서도 큰교훈도 얻고 기대하고 봐도 넘 좋을 영화예요  꼭보시길♥  10점을 주게되면 보통 알바로 오해받을 수 있어서 피했는데 이 영화는 10점줘도 무방하네요 재미 감동 교훈 3박자를 모두 갖춘 영화 단순 로맨스물이 절대 아닙니다  저주인공이 시간을 돌림으로 인해 불행해진사람들이 수두룩할듯 주인공의 행동하나에 인연이 바뀌어져서 불행해진다던지 등등 걍개같은 모순덩어리 영화임  이게 왜 9점대 영화지 이해할수없다 논리적으로 맞지도않고      뭐 저런내용은 예전부터 많지않앗나 웰메이드이긴하지만 7점짜리 정도된다  살면서 2번보고 싶은 영화도 없었고 이렇게 네이버에 후기를 남긴 영화도 없었습니다영화 끝나고 제 온몸을 감싸는 감동은 뭐라 표현할 수 가 없었습니다 그리고 진심아버지가 보고 싶네요아직도 이 영화 생각 뭐내가 좀 눈물이 많긴한데 이 영화를 보면서 진짜 감동적이여서 눈물났음  이 영화가 맥스무비에 광고를 안해서 맥스무비 기자 평이 저런가 후반부 아버지와 아들의 마지막 산책 장면에서 눈시울 붉어진 아들 가진 아빠 1인  최고의영화 다시보고싶다진짜로ㅠ  눈물을 흘리게도 했던 참 감사한 영화였습니다  결혼까지 좋은거는 타임리프해서 꿀빨거 다 빨고 나서 하루하루를 소중히 여기자라고 마지막에 말하는게 무슨 공감이 될수 있을까  로맨틱코미디가 교훈을 주려하니 영화가 산으로 간다  그래도 우리나라에선 감성만 팔면 장땡 아닌가  그냥재미없다이게뭐냐  기대했는데지루했음영화 한편에 이것저것 담아내려다실패한 느낌이다  너무 기대했나 ㅜㅜ 남주가 스스로 사랑을 찾은 게 아니라 시간여행을 이용해 얻었다는 게 보는 내내 감동을 주지 못했음  음뒤늦게 평점만 믿고 보러갔는데솔직히 안봤어 도 될 영화  꿀빨거 다 빨고 시간여행 안하는 남자 주인공이 너무 보기싫었습니다  시간여행물의 기본적인 치밀함이 없어서 몰입을 해치고 그것을 뛰어넘는 주제의식이 있는 것도 아님 결국 주인공은 아무 리스크없이 다 이뤄놓고 이제 행복하니 안써도 된다는 식 개연성과 고민이 없다 포장은 정말 잘해 시간을  되돌리는 영화 중 제일 재미없다  넘 미안했어요 저의 말에 넘어가 함께영화본 친구에게 잔잔한 감동있는 영화좋아라하는편인데 이건 뭐ㅡㅡ연신 나오는 하품에 언제 끝나나 시간만봤네요 평점리뷰에 낚였어요 ㅜㅜ  소재에 비해 생각보다 재미없다  타임워프 능력으로  여자 만나고 결혼하고 애낳는거까지 안되면 될때까지 자기 마음대로 하는거에서부터 이미 공감이 안됨  후반부에 부자지간의 감성팔이 전환도 좀 억지스럽다 역경이나 고난없이 하고싶은거 다 누리고 뒤늦 고평가 되있어서 1점줌 9점대가 믿기지않을만큼 유치한 영화 초반에는 사랑이야기하다가 후반에는 뭔가 교훈을 가르치려한다 근데 그 교훈이 인생을 고생이라곤 해본적 없는 유치찬란한 이야기였다  기대 많이 했는데 ㅠㅠ 정말 지루한 영화  잔잔한 스토리 좋아시는 분들은 심심하게 보시길  평점 914를 보고 엄청 기대하고 보았다 관점은 보는 사람이 처해있는 상황에 따라서 매우 틀려지는것 같다 공감이 가지 않는 내용이었다  완벽하리만큼 따듯한가족 시간을돌리는 능력까지  도대체 뭐하자는건지  감동도 재미도 없는 지 루 한 영화  시간여행을 고작 이렇게 밖에 못쓰나 그리고 시간여행을 다루는 부분에서 논리적으로 말이 안되는점이 너무 많다  너무 뻔하고 억지감동 주먹쥐는건 뭐냐 진짜ㅋㅋㅋ 점수좀 깎자  9점 영화는 확실히 아니야 난 전문가 평점이 맞는것 같소  당췌이 영화가 어느부분이 감동적이라는 것인지억지스럽고 유치하다  내인생의 낭비 유플러스 2500으로 봣는데 죽일까 페북충들  무엇을 말하려는지 의도는 알겠으나 진부함과 약간의 억지스러움  평점이 왜이리 높은지  너무 기대를 많이 한 탓일까 그저 흔한 뻔한 내용처음 만나 밤지내고 사랑을 느끼기에도 충분한 감정선도 없고 몰입감도 제로다평범하게 하루하루 가정에 충실히 최선을 다해 살라는 내용차라리 우리나라 드라마 한편 남자가 하룻밤 못보내서 타이머신 타고 여자 꼬시러 다시 가고 하룻밤을 위해 다시 타이머신   현실적이지도 않고 유치하더만  이게 왜이리 평점이 높음  감동은 있었는데 솔직히 재미없었다 로맨틱한것도 아니고 그렇다고 스토리가 흥미진진한것도 아니고 시간여행이란 소재밖에 없는 평범한 일상 드라마  왜 재밌다는지 모르겠다  엄청재미있는줄 알고봐서 그런가 감동이 약간 있었지만 마음속 깊이 남는건 없었다  평점 7점대만 됐어도 내가 욕안하는데 45점 정도 주고싶었는데 진짜 9점은 너무 심했다 감독의 역대 영화중 제일 별로  너무 평점이 높다는 생각이 드네요 평점보고 기대하시는 분들은 많이 실망하실 것 같아요 저도 재미있게 봤지만 조절을 좀 해야할 것 같습니다 저는 한 7점정도가 정당한 것 같네요  평점보고 봤는데 기대이하 밑댓글처럼 내용이 짬뽕이라 뭘 말하고 싶은지 매우 어수선하다 지루하고  몰입이 안된다 중간중간 예쁜장면들이 있지만 그냥 예쁜장면뿐이다 그것들이 합쳐져 감동이 되진 않는다 벤자민 버 평점 높고 노팅힐 러브액츄얼리 같은 느낌이래서 기대하고 봤는데 정말 지루했음 불 꺼진 클럽 씬에서는 잠들뻔했음 여자들이 보기에는 남주가 매력이 없어서 별로임  남주인공 진짜 매력없네 전체를 이끌어가는 주인공은 일단매력있어야된다스토리도엉망임전부가짜같은느낌 영화가 현실이아니라 영화같은느낌개실망임  7점 정도 되는 영화지만 평점이 너무 거품끼가 있어서  솔직히 괜찮은 영화이지만 거품이 엄청나다 네티즌 평점이랑 기자평론가 평점이랑 차이가 꽤 나느데 영화 보기전에 베플 1위 보고 이 영화 대박이구나 기자들이 괜히 저러는 구나 했는데 영화를 보고나서 기자평론가 평점이 솔직히 말합니다 따뜻함은 있습니다 그러나 재미는 없습니다  시간여행으로 마누라도 얻고 얻을거 다 얻으면서 마지막엔 그냥 현재를 즐겨라뭔가 이상하다 중간에 한번 나온 검은머리 아기는 또 무슨 죄인가보면서도 시간여행 하면서 일도 조금 꼬이고 하다가 마지막에는 현실에 만족하 아니 난 이 거품영화가 대체 왜 9 점인지모르겠다 일생을 살면서 다른 영화를 아예 본적도없나 알바를 풀었나다른남자 여친뺐는 내용에 문제만 생기면 시간역행으로 뚫어버리고 마지막엔 난데없이 가족의 소중함 기대를 너무 많이 한걸까 생각보다 지루하고 어디부분이 클라이막스인지 그냥 지루하게 흘러가다가 끝나네요 너무 많은 감정을 건드리려고 하다가 집중을 흐트리는것같다  평점이 너무 높은거같네요 7점이 적당한거같 평점이 하도 높아서 봤더니만그냥 뻔하고 밋밋한 영화였다뻔한감동 메세지최악  
30,ㅎㅎㅎ  
31,언제든 또 보고 싶은 영화  오랜만에 내 안에 무언가를 꿈틀거리게 했다    시간에 대한 그리고 삶에 대한 생각을 다시 한번 하게 해준 영화 인생은 행복한 시간여행   댓글 알바의 평점을 믿고 영화를 보면 후회하심스토리 없고 감동없고 반전도 없고  빵 웃기지도 않고  물건너온 재미 없는 영화에 황금같은 주말이 낚였네  네번의결혼식과한번의장례식보다재미없음ㅡ 아무튼재미없고 로맨틱하지도않음  평점에 속아서 영화를 보러갔어요 실망스럽네요 라스트 홀리데이 같은 명작을 보고 그다음날에 봐서 그런가마지막즈음엔 졸립더라구요  정말 감성팔이 쓰레기 영화 어휴   화나네요 이딴 영화가 별점9점이라뇨 네이버 알바성 댓글보고 보러가지 마세요롯데시네마에서 방금 보고 나오는데 반은 잠들고 반은 핸드폰만지고 있었어요 보러가지 마세요  별로에요 평점낚시인듯  잼 없습니다진짜로  1점은 평점조절용이고 65점이 적당한듯 메시지는 좋았으나 이미 뻔히 보이는 표현방식에다가 전체적으로 지루했다 이런 소재로는 좀 더 재밌게 만들 수 있을법한데 남주 여주의 사랑도 그닥 로맨틱하게 느껴지지 않았다 억지스러운 시간여행 긴장감도없고 러브스토리도 지루함 9점은절대아니라서 한 6점 줄려고했는데 평점깎을려고1점준다 ㅠㅠ  평점만 보고 갔었는데 전 너무 지루했네요  로또를  안하는 자체가  에러  딱 여자 호주머니를  노린 영화  대충 끼워 맞춘 로맨틱 코메디 7점이상은 아님 10점대는 확실히 알바평점  최악인 정도는 아니지만 평점 9점대 영화는 절대 아닌듯 개인적으로 67점 정도가 적당한거 같지만 평점 알바들이 너무 많은거 같아서 1점 줌  평점 왜케 높은거지 쳇  너무 과대평가됨 평점 조절  내가 이상한건가 도저히 평점이 왜 이렇게 높은지 전체적으로 너무 산만하고 123분동안 무엇을 말하고 싶었는지 전혀 이해 안 됨 로맨스 영화가 이렇게 잠이 온 적은 처음  평점이 왜이리 높은지 이해할 수 없다 말하고자 하는 게 철학적이고 삶에 중요한 교훈을 준다는 건 알겠는데 진부하기 짝이없다 영화도 길고 그냥 흘러가는 느낌이다 물론 영상은 좋지만 7점 대가 적당하다 평점조 
32,언제 봐도 좋습니다 유한한 시간에 대한 가치를 일깨워 주는 영화입니다  
